{
  "threshold_id": "TD-CONTEXT-0001",
  "source_evidence_context": {
    "evidence_bundle_ref": "E4-BUNDLE-001",
    "consistency_guard_refs": ["RC-01","RC-02","RC-03","RC-04","RC-05","RC-06","RC-07","RC-08","RC-09","RC-10","RC-11"],
    "evidence_item_count": 4,
    "consistency_check_count": 11,
    "consistency_pass_count": 8
  },
  "threshold_state": "needs_more_context",
  "rationale": "8 of 11 consistency checks pass. Only 4 evidence items present. Additional evidence collection recommended before Owner review.",
  "evaluated_at": "2026-07-08T03:56:00Z",
  "authority_disclaimer": "This review-depth threshold evaluation is advisory-only. It does not auto-accept evidence, auto-reject findings, execute work, approve intake, verify evidence, close workbench items, mutate the evidence chain, or seal anything. Owner remains the final decision point. Custody is qa-pilot-local. Librarian impact is none.",
  "custody": "qa-pilot-local",
  "advisory_only": true,
  "librarian_impact": "none"
}
